{
  "id": "AU",
  "description": "Australian National Mixed-Case Lettering List (ACSQHC)",
  "source": "Generated by tools/build-lists/build-lists.js from tallman-lists/sources/. See sources/<AUTHORITY>/meta.json for authority provenance.",
  "version": "20240400.0",
  "entries": [
    "aCLin",
    "actoNEL",
    "actoS",
    "aFATinib",
    "aKAMin",
    "alDACTONE",
    "alDOMET",
    "ALKeran",
    "alODORM",
    "amARYl",
    "amiNOPHYLLine",
    "amiODAROne",
    "amiTRIPTYLine",
    "amLODIPine",
    "amOXil",
    "aPomine",
    "arABLOC",
    "arATAC",
    "ARIPiprazole",
    "arOPAX",
    "aTRopt",
    "avaSTIN",
    "avaXIM",
    "aVomine",
    "aXITinib",
    "azATHIOPRINE",
    "aziTHROMYCIN",
    "aZopt",
    "bARICITinib",
    "beNRALizumab",
    "beVACizumab",
    "beZLOTOXumab",
    "biNIMEtinib",
    "bisACODYl",
    "bisOPROLOl",
    "buDESONide",
    "buMETANide",
    "CABAZitaxel",
    "cABOZANtinib",
    "caLTRate",
    "caPTOPRil",
    "caRAFate",
    "CARBAMazepine",
    "carbiMAZOLe",
    "cARBOplatin",
    "caRVEDILOl",
    "cefaLEXin",
    "cefALOTIN",
    "cefaZOLin",
    "cefEPIME",
    "cefOTAXIME",
    "cefOXITIN",
    "ceftAROLine",
    "cefTAZIDIME",
    "cefTRIAXONE",
    "celAPRAM",
    "celEBREX",
    "cHLORPROMAZine",
    "ciclosPORIN",
    "ciprAMIL",
    "ciPROFLOXAcin",
    "ciprOXIN",
    "ciSplatin",
    "cLARITHROMYcin",
    "cloBAZam",
    "cLOMIFEne",
    "cLOMIPRAMine",
    "CLONazepam",
    "cOBIMEtinib",
    "coUMADIN",
    "coVERSYL",
    "cycLIZINE",
    "cycLONEX",
    "CYCLOPHOSPHamide",
    "cyclosERINE",
    "daBRAFEnib",
    "daCTINomycin",
    "daPTomycin",
    "daSATinib",
    "DAUNOrubicin",
    "DEPO-medrol",
    "depo-PROVERA",
    "dePTRAn",
    "deRALin",
    "dexAMETHASOne",
    "dexMEDETOMIDine",
    "DIAzepam",
    "dilaNTIN",
    "dilaUDID",
    "diPRIVan",
    "diPYRIDAMOLe",
    "diSOPYRAMIDe",
    "diTROPan",
    "DOCEtaxel",
    "doSULepin",
    "doTHiepin",
    "doXepin",
    "DOXOrubicin",
    "DULoxetine",
    "eCULizumab",
    "eFALizumab",
    "eMICizumab",
    "ERYthromycin",
    "flucLOXACILLIN",
    "flucONAZOLe",
    "flucYTOSINe",
    "fluVOXAMine",
    "gliBENCLAMide",
    "gliCLAZide",
    "gliMEPIRide",
    "gliPIZide",
    "humALOG",
    "humULIN",
    "hydrALAZINe",
    "hydreA",
    "hydreNE",
    "hydrOCHLOROTHIAZIDe",
    "HYDROmorphone",
    "iDArubicin",
    "iFOSFamide",
    "INDEral",
    "isopto CARpine",
    "isopto HOMATROpine",
    "iSOtretinoin",
    "januMET",
    "januVIA",
    "ketALAR",
    "ketOROLAC",
    "laMICTAl",
    "laMISil",
    "lamiVUDine",
    "lamOTRIGine",
    "lanTUs",
    "lanVis",
    "laPAtinib",
    "laRGACTil",
    "leNVAtinib",
    "LEUKeran",
    "linCOMYCIN",
    "linEZOLID",
    "LORazepam",
    "loSEC",
    "loVAN",
    "mercaptAMine",
    "mercaptOPURine",
    "methADONe",
    "methYLPHENIDATe",
    "moBILis",
    "moVALis",
    "MOXifloxacin",
    "MS Contin",
    "MYLeran",
    "NEOral",
    "nexAVAR",
    "nexiUM",
    "niFEDIPine",
    "niMODIPine",
    "niZATIDine",
    "NORfloxacin",
    "norMISON",
    "norVASC",
    "novoMIX",
    "novoRAPID",
    "oBINUTUZumab",
    "oCRELizumab",
    "oFATUMumab",
    "oMALizumab",
    "OXazepam",
    "OXCARBazepine",
    "oxyCONTIN",
    "oxyNORM",
    "PACLitaxel",
    "pANITUMumab",
    "paRIET",
    "PARoxetine",
    "paXTINE",
    "pAZOPanib",
    "pERTUZumab",
    "pEXSIG",
    "pONATinib",
    "primaCIN",
    "primaCOR",
    "primaXIN",
    "pRISTIQ",
    "proCHLORPERazine",
    "proGRAF",
    "proMETHazine",
    "propOFol",
    "propRANOLol",
    "proZAC",
    "QUETIAPine",
    "RABEprazole",
    "raMUCIRumab",
    "raNIBIZumab",
    "rifaMPICin",
    "rifaXIMin",
    "riSPERIDONe",
    "rOPINIROLe",
    "sAXagliptin",
    "SERTRALine",
    "Sirolimus",
    "siTagliptin",
    "solu-CORTEF",
    "SOLU-medrol",
    "soNIDEGib",
    "soRAFENib",
    "sulfaDiazine",
    "sulfaSALazine",
    "sUMATRIPTAn",
    "sUNITinib",
    "TACrolimus",
    "tAPENTadol",
    "tEGRETOl",
    "tEMOdal",
    "tOFACitinib",
    "toFRANIL",
    "toPAMAX",
    "tORadol",
    "tRAMadol",
    "tRAMEtinib",
    "tRENTAl",
    "trimEPRAZINE",
    "trimETHOPRIM",
    "valAciclovir",
    "valGANciclovir",
    "vinBLASTine",
    "vinCRISTine",
    "vinORELBine",
    "xalaCOM",
    "xalaTAN",
    "zinNAt",
    "zinVit",
    "zoCOR",
    "zoLOFT",
    "zoTON"
  ]
}
