{
  "id": "FDA",
  "description": "FDA Name Differentiation Project List (US FDA)",
  "source": "Generated by tools/build-lists/build-lists.js from tallman-lists/sources/. See sources/<AUTHORITY>/meta.json for authority provenance.",
  "version": "20260612.0",
  "entries": [
    "acetaZOLAMIDE",
    "acetoHEXAMIDE",
    "buPROPion",
    "busPIRone",
    "CARBOplatin",
    "chlorproMAZINE",
    "chlorproPAMIDE",
    "CISplatin",
    "clomiPHENE",
    "clomiPRAMINE",
    "cycloSERINE",
    "cycloSPORINE",
    "DAUNOrubicin",
    "dimenhyDRINATE",
    "diphenhydrAMINE",
    "DOBUTamine",
    "DOPamine",
    "DOXOrubicin",
    "glipiZIDE",
    "glyBURIDE",
    "hydrALAZINE",
    "HYDROmorphone",
    "hydrOXYzine",
    "medroxyPROGESTERone",
    "methylPREDNISolone",
    "methylTESTOSTERone",
    "migALAstat",
    "migLUstat",
    "mitoXANTRONE",
    "niCARdipine",
    "NIFEdipine",
    "prednisoLONE",
    "predniSONE",
    "risperiDONE",
    "rOPINIRole",
    "sulfADIAZINE",
    "sulfiSOXAZOLE",
    "TOLAZamide",
    "TOLBUTamide",
    "traMADol",
    "traZODone",
    "vinBLAStine",
    "vinCRIStine"
  ]
}
