{
  "id": "DEFAULT",
  "description": "Default Tall Man list (AU+NZ+ISMP, precedence AU>NZ>ISMP). Sources: AU 20240400.0, NZ 20231000.0, ISMP 20230100.0.",
  "source": "Generated by tools/build-lists/build-lists.js from tallman-lists/sources/. See sources/<AUTHORITY>/meta.json for authority provenance.",
  "version": "20240400.0",
  "entries": [
    "acetaZOLAMIDE",
    "acetoHEXAMIDE",
    "aCLin",
    "actoNEL",
    "actoS",
    "aFATinib",
    "aKAMin",
    "alDACTONE",
    "alDOMET",
    "aLEMTUzumab",
    "ALfentanil",
    "ALKeran",
    "aLLOPURINol",
    "alODORM",
    "ALPRAZolam",
    "amARYl",
    "aMILoride",
    "amiNOPHYLLine",
    "amiODAROne",
    "amiSULPRIDe",
    "amiTRIPTYLine",
    "amLODIPine",
    "amOXil",
    "aPomine",
    "arABLOC",
    "arATAC",
    "ARIPiprazole",
    "arOPAX",
    "aTENOLol",
    "aTEZOLIzumab",
    "aTRopt",
    "avaSTIN",
    "avaXIM",
    "aVomine",
    "aXITinib",
    "azaCITIDine",
    "azATHIOPRINE",
    "aziTHROMYCIN",
    "aZopt",
    "bARICITinib",
    "beNRALizumab",
    "BENZATHINE benzylpenicillin",
    "beVACizumab",
    "beZLOTOXumab",
    "biNIMEtinib",
    "bisACODYl",
    "bisOPROLOl",
    "buDESONide",
    "buMETANide",
    "BUPivacaine",
    "buPROPION",
    "buSPIRONE",
    "CABAZitaxel",
    "cABOZANtinib",
    "caLTRate",
    "caPTOPRil",
    "caRAFate",
    "CARBAMazepine",
    "carbiMAZOLe",
    "cARBOplatin",
    "caRVEDILOl",
    "cefaCLOR",
    "cefaLEXin",
    "cefALOTIN",
    "cefaZOLin",
    "cefEPIME",
    "cefOTAXIME",
    "cefoTEtan",
    "cefOXITIN",
    "ceftAROLine",
    "cefTAZIDIME",
    "cefTRIAXONE",
    "cefUROXIME",
    "celAPRAM",
    "celEBREX",
    "CeleXA",
    "cephaLEXin",
    "cephaZOLin",
    "CETUximab",
    "chlordiazePOXIDE",
    "cHLORPROMAZine",
    "chlorproPAMIDE",
    "ciclosPORIN",
    "ciprAMIL",
    "ciPROFLOXAcin",
    "ciprOXIN",
    "ciSplatin",
    "cLARITHROMYcin",
    "clINDAmycin",
    "cloBAZam",
    "cLOMIFEne",
    "cLOMIPHEne",
    "cLOMIPRAMine",
    "CLONazepam",
    "cloNIDine",
    "cLOZAPine",
    "cOBIMEtinib",
    "coUMADIN",
    "coVERSYL",
    "cycLIZINE",
    "cyclOBLASTIN",
    "cycLONEX",
    "CYCLOPHOSPHamide",
    "cyclosERINE",
    "cyclosPORIN",
    "cycloSPORINE",
    "daBRAFEnib",
    "daCTINomycin",
    "daPTomycin",
    "daSATinib",
    "DAUNOrubicin",
    "DEPO-medrol",
    "depo-PROVERA",
    "dePTRAn",
    "deRALin",
    "dexAMETHASOne",
    "dexMEDETOMIDine",
    "DIAzepam",
    "dIGOXin",
    "dilaNTIN",
    "dilaUDID",
    "dilTIAZem",
    "dimenhyDRINATE",
    "diphenhydrAMINE",
    "diPRIVan",
    "diPYRIDAMOLe",
    "diSOPYRAMIDe",
    "diTROPan",
    "doBUTamine",
    "DOCEtaxel",
    "doPamine",
    "doSULepin",
    "doTHiepin",
    "dOXAZOSin",
    "doXepin",
    "DOXOrubicin",
    "droNABinol",
    "droPERidol",
    "DULoxetine",
    "eCULizumab",
    "eFALizumab",
    "eMICizumab",
    "ePHEDrine",
    "EPINEPHrine",
    "epiRUBicin",
    "eriBULin",
    "ERYthromycin",
    "fentaNYL",
    "flavoxATE",
    "fluARIx",
    "flucLOXACILLIN",
    "flucONAZOLe",
    "flucYTOSINe",
    "FLUoxetine",
    "flupENTHIXOL",
    "flupENTIXOL",
    "flupHENAZINE",
    "fluVAx",
    "fluVOXAMine",
    "foliNIc acid",
    "gliBENCLAMide",
    "gliCLAZide",
    "gliMEPIRide",
    "gliPIZide",
    "glyBURIDE",
    "guaiFENesin",
    "guanFACINE",
    "humALOG",
    "humULIN",
    "hydrALAZINe",
    "hydreA",
    "hydreNE",
    "hydrOCHLOROTHIAZIDe",
    "HYDROcodone",
    "HYDROmorphone",
    "HYDROXYprogesterone",
    "hydrOXYzine",
    "hyoscine BUTYLbromide",
    "hyoscine HYDRObromide",
    "iDArubicin",
    "idaruCIZUmab",
    "iFOSFamide",
    "imUPRine",
    "INDEral",
    "INFLIximab",
    "isopto CARpine",
    "isopto HOMATROpine",
    "iSOtretinoin",
    "januMET",
    "januVIA",
    "ketALAR",
    "ketOROLAC",
    "KlonoPIN",
    "laMICTAl",
    "laMISil",
    "lamiVUDine",
    "lamOTRIGine",
    "lanTUs",
    "lanVis",
    "laPAtinib",
    "laRGACTil",
    "leNVAtinib",
    "LEUKeran",
    "levETIRAcetam",
    "levOCARNitine",
    "levoFLOXacin",
    "LEVOleucovorin",
    "linCOMYCIN",
    "linEZOLID",
    "LORazepam",
    "loSEC",
    "loVAN",
    "loxaLATe",
    "loxaMINe",
    "m-eNALAPRIL",
    "m-eSLON",
    "maxiDEX",
    "maxiTROL",
    "meDROXYPROGESTERone",
    "mercaptAMine",
    "mercaptOPURine",
    "metFORMIN",
    "methADONe",
    "methazolAMIDE",
    "methIMAzole",
    "metHOTREXATe",
    "methYLPHENIDATe",
    "methylPREDNISolone",
    "methylprednisolone ACETate",
    "methylprednisolone SODIUM SUCCINate",
    "methylTESTOSTERone",
    "metOCLOPRAMIDe",
    "metOLazone",
    "metoPROLOL",
    "metroNIDAZOLE",
    "metyraPONE",
    "metyroSINE",
    "miFEPRIStone",
    "migALAstat",
    "migLUstat",
    "miSOPROStol",
    "mitoMYcin",
    "mitoXANTRONE",
    "moBILis",
    "moVALis",
    "MOXifloxacin",
    "MS Contin",
    "MYLeran",
    "nalOXone",
    "nalTREXone",
    "neO-MERCAZOLe",
    "NEOral",
    "neUROKARe",
    "nexAVAR",
    "nexiUM",
    "niCARdipine",
    "niFEDIPine",
    "niMODIPine",
    "NITRazepam",
    "niZATIDine",
    "NORfloxacin",
    "norMISON",
    "norVASC",
    "NovoLIN",
    "NovoLOG",
    "novoMIX",
    "novoRAPID",
    "novoSEVEN",
    "oBINUTUZumab",
    "oCRELizumab",
    "oFATUMumab",
    "OLANZapine",
    "oMALizumab",
    "OXazepam",
    "OXCARBazepine",
    "oxyBUTYnin",
    "oxyCODONE",
    "oxyCONTIN",
    "oxyMORphone",
    "oxyNORM",
    "PACLitaxel",
    "pANITUMumab",
    "paRIET",
    "PARoxetine",
    "paXTINE",
    "pAZOPanib",
    "pegFILGRASTIM",
    "pegINTERFERON",
    "PEMEtrexed",
    "penicillAMINE",
    "PENTobarbital",
    "pERTUZumab",
    "pEXSIG",
    "PHENobarbital",
    "PHYSostigmine",
    "pONATinib",
    "PRALAtrexate",
    "prednisoLONE",
    "prEDNISone",
    "PriLOSEC",
    "primaCIN",
    "primaCOR",
    "primAQUIne",
    "primaXIN",
    "primIDOne",
    "pRISTIQ",
    "proCHLORPERazine",
    "procYCLIDine",
    "proGRAF",
    "proMETHazine",
    "propOFol",
    "propRANOLol",
    "proZAC",
    "pyRIDostigmine",
    "QUETIAPine",
    "quiNIDine",
    "quINine",
    "RABEprazole",
    "raMUCIRumab",
    "raNIBIZumab",
    "raNITIdine",
    "rifaMPICin",
    "rifAMPin",
    "rifaXIMin",
    "riMANTAdine",
    "RisperDAL",
    "riSPERIDONe",
    "RITUximab",
    "romiDEPsin",
    "romiPLOStim",
    "rOPINIROLe",
    "ROPivacaine",
    "SandIMMUNE",
    "SandoSTATIN",
    "sAXagliptin",
    "SERTRALine",
    "Sirolimus",
    "siTagliptin",
    "solu-CORTEF",
    "SOLU-medrol",
    "soNIDEGib",
    "soRAFENib",
    "SUFentanil",
    "sulfaDiazine",
    "sulfaSALazine",
    "sulfiSOXAZOLE",
    "sUMATRIPTAn",
    "sUNITinib",
    "TACrolimus",
    "TAMoxifen",
    "tAPENTadol",
    "tEGRETOl",
    "tEMOdal",
    "tiaGABine",
    "tiZANidine",
    "tOFACitinib",
    "toFRANIL",
    "TOLAZamide",
    "TOLBUTamide",
    "toPAMAX",
    "tORadol",
    "tRAMadol",
    "tRAMEtinib",
    "traZODone",
    "tRENTAl",
    "trimEPRAZINE",
    "trimETHOPRIM",
    "valAciclovir",
    "valACYclovir",
    "valGANciclovir",
    "vinBLASTine",
    "vinCRISTine",
    "vinORELBine",
    "xalaCOM",
    "xalaTAN",
    "yasMIN",
    "yaZ",
    "zinNAt",
    "zinVit",
    "zoCOR",
    "ZOLMitriptan",
    "zoLOFT",
    "zoTON",
    "ZyPREXA",
    "ZyrTEC"
  ]
}
