{
  "id": "NZ",
  "description": "Aotearoa New Zealand Tall Man Lettering List (HQSC)",
  "source": "Generated by tools/build-lists/build-lists.js from tallman-lists/sources/. See sources/<AUTHORITY>/meta.json for authority provenance.",
  "version": "20231000.0",
  "entries": [
    "aFATinib",
    "aLEMTUzumab",
    "ALKeran",
    "aLLOPURINol",
    "amINOPHYLLIne",
    "amIODAROne",
    "amiSULPRIDe",
    "amITRIPTYLIne",
    "amLODIPIne",
    "aPomine",
    "arATAC",
    "arOPAX",
    "aTENOLol",
    "aTEZOLIzumab",
    "aTRopt",
    "avaSTIN",
    "avaXIM",
    "aVomine",
    "aXITinib",
    "azATHIOPRINE",
    "azITHROMYCIN",
    "aZopt",
    "BENZATHINE benzylpenicillin",
    "beVACizumab",
    "bisACODYl",
    "bisOPROLOl",
    "buDESONide",
    "buMETANide",
    "buPROPION",
    "buSPIRONE",
    "caLTRate",
    "caPTOPRIl",
    "caRAFate",
    "CARBAMazepine",
    "carbIMAZOLe",
    "cARBOplatin",
    "caRVEDILOl",
    "cefaCLOR",
    "cefaLEXin",
    "cefaZOLin",
    "cefEPIME",
    "cefOTAXIME",
    "cefOXITIN",
    "ceftAROLine",
    "cefTAZIDIME",
    "cefTRIAXONE",
    "cefUROXIME",
    "celAPRAM",
    "celEBREX",
    "cephaLEXin",
    "cephaZOLin",
    "CETUximab",
    "cHLORPROMAZIne",
    "ciclosPORIN",
    "ciprAMIL",
    "cIPROFLOXAcin",
    "ciprOXIN",
    "cISplatin",
    "cLARITHROMYcin",
    "clINDAmycin",
    "cLOMIFEne",
    "cLOMIPHEne",
    "cLOMIPRAMIne",
    "CLONazepam",
    "cloNIDine",
    "cLOZAPine",
    "cOBIMEtinib",
    "coUMADIN",
    "coVERSYL",
    "cyclIZINE",
    "cyclOBLASTIN",
    "CYCLOPHOSPHamide",
    "cyclosERINE",
    "cyclosPORIN",
    "daBRAFEnib",
    "daCTINomycin",
    "daPTomycin",
    "daSATinib",
    "DAUNOrubicin",
    "DEPO-medrol",
    "depo-PROVERA",
    "DIazepam",
    "dIGOXin",
    "diPYRIDAMOLe",
    "diSOPYRAMIDe",
    "doBUTamine",
    "DOCEtaxel",
    "doPamine",
    "doTHIEpin",
    "dOXAZOSin",
    "doXEpin",
    "DOXOrubicin",
    "DULoxetine",
    "ERYthromycin",
    "flupENTHIXOL",
    "flupENTIXOL",
    "flupHENAZINE",
    "fluVAx",
    "fluVOXAMine",
    "foliNIc acid",
    "gliBENCLAMide",
    "gliCLAZide",
    "gliPIZide",
    "humALOG",
    "humULIN",
    "hyoscine BUTYLbromide",
    "hyoscine HYDRObromide",
    "IDArubicin",
    "IFOSFamide",
    "imUPRine",
    "INDEral",
    "INFLIximab",
    "isopto CARpine",
    "isopto HOMATROpine",
    "ISOtretinoin",
    "januMET",
    "januVIA",
    "ketALAR",
    "ketOROLAC",
    "laMICTAl",
    "laMISIl",
    "lamIVUDine",
    "lamOTRIGine",
    "lanTUs",
    "lanVIs",
    "laPAtinib",
    "laRGACTIl",
    "LEUKeran",
    "LORazepam",
    "loxaLATe",
    "loxaMINe",
    "m-eNALAPRIL",
    "m-eSLON",
    "maxiDEX",
    "maxiTROL",
    "meDROXYPROGESTERone",
    "mercaptAMine",
    "mercaptOPURine",
    "methADONe",
    "metHOTREXATe",
    "methYLPHENIDATe",
    "methylprednisolone ACETate",
    "methylprednisolone SODIUM SUCCINate",
    "metOCLOPRAMIDe",
    "metoPROLOL",
    "MOXIfloxacin",
    "MYLeran",
    "nalOXone",
    "nalTREXone",
    "neO-MERCAZOLe",
    "NEOral",
    "neUROKARe",
    "niFEDIPine",
    "niMODIPine",
    "NITRazepam",
    "NORfloxacin",
    "norMISON",
    "norVASC",
    "novoMIX",
    "novoRAPID",
    "novoSEVEN",
    "oBINUTUZumab",
    "oMALizumab",
    "OXazepam",
    "OXCARBazepine",
    "oxyCONTIN",
    "oxyNORM",
    "PACLItaxel",
    "PARoxetine",
    "pAZOPanib",
    "pegFILGRASTIM",
    "pegINTERFERON",
    "penicillAMINE",
    "pERTUZumab",
    "prEDNISone",
    "primaCIN",
    "primaCOR",
    "primAQUIne",
    "primaXIN",
    "primIDOne",
    "proCHLORPERazine",
    "procYCLIDine",
    "proGRAF",
    "proMETHazine",
    "propOFol",
    "propRANOLol",
    "proZAC",
    "QUETIAPine",
    "quINine",
    "rifaMPICin",
    "rifaXIMin",
    "riSPERIDONe",
    "RITUximab",
    "rOPINIROLe",
    "SERTRALine",
    "SIrolimus",
    "siTagliptin",
    "solu-CORTEF",
    "SOLU-medrol",
    "soRAFENib",
    "sulfaDIazine",
    "sulfaSALazine",
    "sUMATRIPTAn",
    "sUNITinib",
    "TACrolimus",
    "TAMoxifen",
    "tEMOdal",
    "toFRANIL",
    "toPAMAX",
    "tRAMadol",
    "trimEPRAZINE",
    "trimETHOPRIM",
    "valAciclovir",
    "valGANciclovir",
    "vinBLASTine",
    "vinCRISTine",
    "vinORELBine",
    "yasMIN",
    "yaZ"
  ]
}
