{
  "id": "ISMP",
  "description": "FDA and ISMP Lists of Look-Alike Drug Names (ISMP combined)",
  "source": "Generated by tools/build-lists/build-lists.js from tallman-lists/sources/. See sources/<AUTHORITY>/meta.json for authority provenance.",
  "version": "20230100.0",
  "entries": [
    "acetaZOLAMIDE",
    "acetoHEXAMIDE",
    "ALPRAZolam",
    "aMILoride",
    "amLODIPine",
    "ARIPiprazole",
    "AVINza",
    "azaCITIDine",
    "azaTHIOprine",
    "buPROPion",
    "busPIRone",
    "carBAMazepine",
    "CARBOplatin",
    "ceFAZolin",
    "cefoTEtan",
    "cefOXitin",
    "cefTAZidime",
    "cefTRIAXone",
    "CeleBREX",
    "CeleXA",
    "chlordiazePOXIDE",
    "chlorproMAZINE",
    "chlorproPAMIDE",
    "CISplatin",
    "cloBAZam",
    "clomiPHENE",
    "clomiPRAMINE",
    "clonazePAM",
    "cloNIDine",
    "cloZAPine",
    "cycloSERINE",
    "cycloSPORINE",
    "DACTINomycin",
    "DAPTOmycin",
    "DAUNOrubicin",
    "DEPO-Medrol",
    "diazePAM",
    "dilTIAZem",
    "dimenhyDRINATE",
    "diphenhydrAMINE",
    "DOBUTamine",
    "DOCEtaxel",
    "DOPamine",
    "DOXOrubicin",
    "DULoxetine",
    "ePHEDrine",
    "EPINEPHrine",
    "epiRUBicin",
    "eriBULin",
    "fentaNYL",
    "flavoxATE",
    "FLUoxetine",
    "fluPHENAZine",
    "fluvoxaMINE",
    "glipiZIDE",
    "glyBURIDE",
    "guaiFENesin",
    "guanFACINE",
    "HumaLOG",
    "HumuLIN",
    "hydrALAZINE",
    "hydroCHLOROthiazide",
    "HYDROcodone",
    "HYDROmorphone",
    "HYDROXYprogesterone",
    "hydrOXYzine",
    "IDArubicin",
    "idaruCIZUmab",
    "inFLIXimab",
    "INVanz",
    "ISOtretinoin",
    "KlonoPIN",
    "LaMICtal",
    "LamISIL",
    "lamiVUDine",
    "lamoTRIgine",
    "levETIRAcetam",
    "levOCARNitine",
    "levoFLOXacin",
    "LEVOleucovorin",
    "LORazepam",
    "medroxyPROGESTERone",
    "metFORMIN",
    "methazolAMIDE",
    "methIMAzole",
    "methylPREDNISolone",
    "methylTESTOSTERone",
    "metOLazone",
    "metroNIDAZOLE",
    "metyraPONE",
    "metyroSINE",
    "miFEPRIStone",
    "migALAstat",
    "migLUstat",
    "miSOPROStol",
    "mitoMYcin",
    "mitoXANTRONE",
    "NexAVAR",
    "NexIUM",
    "niCARdipine",
    "NIFEdipine",
    "niMODipine",
    "NovoLIN",
    "NovoLOG",
    "OLANZapine",
    "OXcarbazepine",
    "oxyCODONE",
    "OxyCONTIN",
    "oxyMORphone",
    "PACLitaxel",
    "PARoxetine",
    "PAZOPanib",
    "PEMEtrexed",
    "penicillAMINE",
    "PENTobarbital",
    "PHENobarbital",
    "PONATinib",
    "PRALAtrexate",
    "prednisoLONE",
    "predniSONE",
    "PriLOSEC",
    "PROzac",
    "QUEtiapine",
    "quiNIDine",
    "quiNINE",
    "RABEprazole",
    "raNITIdine",
    "rifAMPin",
    "rifAXIMin",
    "riMANTAdine",
    "RisperDAL",
    "risperiDONE",
    "riTUXimab",
    "romiDEPsin",
    "romiPLOStim",
    "rOPINIRole",
    "SandIMMUNE",
    "SandoSTATIN",
    "sAXagliptin",
    "SEROquel",
    "SINEquan",
    "SITagliptin",
    "Solu-CORTEF",
    "SOLU-Medrol",
    "SORAfenib",
    "SUFentanil",
    "sulfADIAZINE",
    "sulfaSALAzine",
    "sulfiSOXAZOLE",
    "SUMAtriptan",
    "SUNItinib",
    "TEGretol",
    "tiaGABine",
    "tiZANidine",
    "TOLAZamide",
    "TOLBUTamide",
    "traMADol",
    "traZODone",
    "TRENtal",
    "valACYclovir",
    "valGANciclovir",
    "vinBLAStine",
    "vinCRIStine",
    "ZOLMitriptan",
    "ZyPREXA",
    "ZyrTEC"
  ]
}
